292	news	Uvalde-area Democrat enters race to unseat Ted Cruz
293	news	Accused Philadelphia shooter may have begun his spree nearly two days earlier than police thought
294	fitness & health	The FDA is being asked to look into Logan Paul's energy drink, which has the caffeine of 6 Coke cans
295	news	Simultaneous searches unfolding on opposite sides of the country for suspected murderers who escaped from custody
296	news	Zelenskyy to ABC: How Russia-Ukraine war could end, thoughts on US politics and Putin's weakness
297	news	 How many Russians have died in Ukraine? Data shows what Moscow hides
298	news	US sending controversial cluster munitions to Ukraine until other ammo is ready: Kirby
299	news	Biden journeys through Europe ahead of NATO summit
